{
  "$schema": "https://json-schema.org/draft/2020-12/schema",
  "$id": "https://quicperf.invalid/schemas/experiment-v2.3.schema.json",
  "title": "ExperimentSpecV2.3",
  "type": "object",
  "additionalProperties": false,
  "required": ["schema_version","control_protocol_version","name","campaign_kind","estimand","methodology","roles","workloads","backends","paths","treatment","timing","schedule","analysis","manifest_policy","validity","retry","expected_cardinality","qualification"],
  "properties": {
    "schema_version": {"const":"quicperf.experiment.v2.3"},
    "control_protocol_version": {"const":"quicperf.control.v1"},
    "name": {"$ref":"#/$defs/id"},
    "campaign_kind": {"enum":["publication","capacity","memory","tail","diagnostic","qualification","ci"]},
    "estimand": {"enum":["fixed_treatment_server","capacity_frontier","memory_curve","tail_latency","symmetric_diagnostic","behavioral_validation"]},
    "methodology": {"$ref":"#/$defs/methodology"},
    "roles": {"$ref":"#/$defs/roles"},
    "workloads": {"type":"array","minItems":1,"items":{"$ref":"#/$defs/workload"}},
    "backends": {"$ref":"#/$defs/backends"},
    "paths": {"type":"array","minItems":1,"items":{"$ref":"#/$defs/path"}},
    "treatment": {"$ref":"#/$defs/treatment"},
    "timing": {"$ref":"#/$defs/timing"},
    "schedule": {"$ref":"#/$defs/schedule"},
    "analysis": {"$ref":"#/$defs/analysis"},
    "manifest_policy": {"$ref":"#/$defs/manifestPolicy"},
    "validity": {"$ref":"#/$defs/validity"},
    "retry": {"$ref":"#/$defs/retry"},
    "expected_cardinality": {"$ref":"#/$defs/cardinality"},
    "qualification": {"$ref":"#/$defs/qualification"}
  },
  "$defs": {
    "id": {"type":"string","pattern":"^[a-z][a-z0-9]*(?:[._-][a-z0-9]+)*$"},
    "positiveInt": {"type":"integer","minimum":1,"maximum":9223372036854775807},
    "nonnegativeInt": {"type":"integer","minimum":0,"maximum":9223372036854775807},
    "decimal": {"type":"string","pattern":"^(?:0|-?[1-9][0-9]*)(?:\\.[0-9]*[1-9])?$"},
    "digest": {"type":"string","pattern":"^[0-9a-f]{64}$"},
    "methodology": {"type":"object","additionalProperties":false,"required":["version","control_plane","monitor","runtime"],"properties":{"version":{"const":"2.3"},"control_plane":{"type":"object","additionalProperties":false,"required":["arm_lead_ns","pre_send_guard_ns","pre_send_rebase_maximum","late_arm_retry_budget_per_session","live_monitoring_contract"],"properties":{"arm_lead_ns":{"const":750000000},"pre_send_guard_ns":{"const":500000000},"pre_send_rebase_maximum":{"const":2},"late_arm_retry_budget_per_session":{"const":1},"live_monitoring_contract":{"const":"passive_service_events_no_live_journal_polling"}}},"monitor":{"type":"object","additionalProperties":false,"required":["boundary_timestamp_semantics","interval_duration_error_max_fraction","phase_offset_max_ns","combined_tctl_gap_max_ns","localized_transient_budget_per_session"],"properties":{"boundary_timestamp_semantics":{"const":"observed_interval"},"interval_duration_error_max_fraction":{"const":"0.001"},"phase_offset_max_ns":{"type":"integer","minimum":1,"maximum":5000000},"combined_tctl_gap_max_ns":{"const":250000000},"localized_transient_budget_per_session":{"type":"integer","minimum":0,"maximum":12}}},"runtime":{"type":"object","additionalProperties":false,"required":["useful_time_publication_gate","operational_session_timeout_ns","deterministic_verification_budget_ns","admission_conservative_reservation_ns","analysis_finalization_export_budget_ns","scheduled_campaign_floor_ns","clean_start_conservative_budget_ns","suite_deadline_ns","historical_evidence_artifact","historical_evidence_sha256"],"properties":{"useful_time_publication_gate":{"const":false},"operational_session_timeout_ns":{"const":10800000000000},"deterministic_verification_budget_ns":{"const":1200000000000},"admission_conservative_reservation_ns":{"const":3847800000000},"analysis_finalization_export_budget_ns":{"const":600000000000},"scheduled_campaign_floor_ns":{"const":13921000000000},"clean_start_conservative_budget_ns":{"const":27247800000000},"suite_deadline_ns":{"const":30000000000000},"historical_evidence_artifact":{"type":"string","minLength":1},"historical_evidence_sha256":{"$ref":"#/$defs/digest"}}}}},
    "roles": {"type":"object","additionalProperties":false,"required":["servers","reference_clients"],"properties":{"servers":{"type":"array","minItems":1,"uniqueItems":true,"items":{"$ref":"#/$defs/id"}},"reference_clients":{"type":"array","minItems":1,"uniqueItems":true,"items":{"$ref":"#/$defs/id"}}}},
    "backends": {"type":"object","additionalProperties":false,"required":["server","reference_client"],"properties":{"server":{"const":["iouring"]},"reference_client":{"const":"iouring"}}},
    "workload": {"type":"object","additionalProperties":false,"required":["scenario","path_profile","connections","streams_per_connection","request_body_bytes","response_body_bytes","message_body_bytes","datagram_body_bytes","application_chunk_bytes","measurement_ns","warmup_ns","operation_slots","concurrency_grid","connection_count_grid","connection_window_bytes","stream_window_bytes","ticket_chains","eligible_operation_limit","datagram_unreturned_per_connection","datagram_unreturned_aggregate"],"properties":{"scenario":{"$ref":"#/$defs/id"},"path_profile":{"$ref":"#/$defs/id"},"connections":{"$ref":"#/$defs/positiveInt"},"streams_per_connection":{"$ref":"#/$defs/positiveInt"},"request_body_bytes":{"$ref":"#/$defs/positiveInt"},"response_body_bytes":{"$ref":"#/$defs/positiveInt"},"message_body_bytes":{"$ref":"#/$defs/positiveInt"},"datagram_body_bytes":{"$ref":"#/$defs/positiveInt"},"application_chunk_bytes":{"$ref":"#/$defs/positiveInt"},"measurement_ns":{"$ref":"#/$defs/positiveInt"},"warmup_ns":{"$ref":"#/$defs/nonnegativeInt"},"operation_slots":{"$ref":"#/$defs/positiveInt"},"concurrency_grid":{"type":"array","minItems":1,"uniqueItems":true,"items":{"$ref":"#/$defs/positiveInt"}},"connection_count_grid":{"type":"array","minItems":1,"uniqueItems":true,"items":{"$ref":"#/$defs/nonnegativeInt"}},"connection_window_bytes":{"$ref":"#/$defs/positiveInt"},"stream_window_bytes":{"$ref":"#/$defs/positiveInt"},"ticket_chains":{"$ref":"#/$defs/nonnegativeInt"},"eligible_operation_limit":{"$ref":"#/$defs/nonnegativeInt"},"datagram_unreturned_per_connection":{"$ref":"#/$defs/nonnegativeInt"},"datagram_unreturned_aggregate":{"$ref":"#/$defs/nonnegativeInt"}}},
    "path": {"type":"object","additionalProperties":false,"required":["name","content_hash","trace_policy","trace_seed_derivation","one_way_delay_ns","loss_percent","dynamic"],"properties":{"name":{"$ref":"#/$defs/id"},"content_hash":{"$ref":"#/$defs/digest"},"trace_policy":{"enum":["none","deterministic_hmac"]},"trace_seed_derivation":{"enum":["none","campaign_microblock_path_hmac_sha256"]},"one_way_delay_ns":{"$ref":"#/$defs/nonnegativeInt"},"loss_percent":{"$ref":"#/$defs/decimal"},"dynamic":{"type":"boolean"}}},
    "transport": {"type":"object","additionalProperties":false,"required":["quic_version","alpn","congestion_controller","initial_congestion_window_bytes","max_udp_payload_size","max_ack_delay_ns","ack_delay_exponent","ack_frequency","active_migration","active_connection_id_limit","connection_id_bytes","max_idle_timeout_ns","stream_credit_bidi","stream_credit_uni","stream_credit_replenish_below","connection_window_bytes","stream_window_bytes","datagram_max_frame_size"],"properties":{"quic_version":{"type":"string","minLength":1},"alpn":{"type":"string","minLength":1},"congestion_controller":{"$ref":"#/$defs/id"},"initial_congestion_window_bytes":{"$ref":"#/$defs/positiveInt"},"max_udp_payload_size":{"$ref":"#/$defs/positiveInt"},"max_ack_delay_ns":{"$ref":"#/$defs/positiveInt"},"ack_delay_exponent":{"$ref":"#/$defs/positiveInt"},"ack_frequency":{"type":"boolean"},"active_migration":{"type":"boolean"},"active_connection_id_limit":{"$ref":"#/$defs/positiveInt"},"connection_id_bytes":{"$ref":"#/$defs/positiveInt"},"max_idle_timeout_ns":{"$ref":"#/$defs/positiveInt"},"stream_credit_bidi":{"$ref":"#/$defs/positiveInt"},"stream_credit_uni":{"$ref":"#/$defs/positiveInt"},"stream_credit_replenish_below":{"$ref":"#/$defs/positiveInt"},"connection_window_bytes":{"$ref":"#/$defs/positiveInt"},"stream_window_bytes":{"$ref":"#/$defs/positiveInt"},"datagram_max_frame_size":{"$ref":"#/$defs/positiveInt"}}},
    "tls": {"type":"object","additionalProperties":false,"required":["version","cipher_suite","key_exchange","leaf_signature","ca_path","chain_path","hostname","verify","calendar_unix_seconds","ticket_lifetime_ns","maximum_early_data_bytes","one_use_tickets"],"properties":{"version":{"type":"string","minLength":1},"cipher_suite":{"type":"string","minLength":1},"key_exchange":{"type":"string","minLength":1},"leaf_signature":{"type":"string","minLength":1},"ca_path":{"type":"string","minLength":1},"chain_path":{"type":"string","minLength":1},"hostname":{"type":"string","minLength":1},"verify":{"type":"boolean"},"calendar_unix_seconds":{"$ref":"#/$defs/positiveInt"},"ticket_lifetime_ns":{"$ref":"#/$defs/positiveInt"},"maximum_early_data_bytes":{"$ref":"#/$defs/nonnegativeInt"},"one_use_tickets":{"type":"boolean"}}},
    "socket": {"type":"object","additionalProperties":false,"required":["ipv4","mtu","receive_batch","send_batch","requested_send_buffer_bytes","requested_receive_buffer_bytes","buffer_pool_size","application_buffer_bytes","reuse_port","pmtud","udp_gso","udp_gro","ecn","receive_timestamps","busy_polling","common_core_pacing"],"properties":{"ipv4":{"type":"boolean"},"mtu":{"$ref":"#/$defs/positiveInt"},"receive_batch":{"$ref":"#/$defs/positiveInt"},"send_batch":{"$ref":"#/$defs/positiveInt"},"requested_send_buffer_bytes":{"$ref":"#/$defs/positiveInt"},"requested_receive_buffer_bytes":{"$ref":"#/$defs/positiveInt"},"buffer_pool_size":{"$ref":"#/$defs/positiveInt"},"application_buffer_bytes":{"$ref":"#/$defs/positiveInt"},"reuse_port":{"type":"boolean"},"pmtud":{"type":"boolean"},"udp_gso":{"type":"boolean"},"udp_gro":{"type":"boolean"},"ecn":{"type":"boolean"},"receive_timestamps":{"type":"boolean"},"busy_polling":{"type":"boolean"},"common_core_pacing":{"type":"boolean"}}},
    "resources": {"type":"object","additionalProperties":false,"required":["server_cpu_max","client_cpu_max","server_memory_max_bytes","client_memory_max_bytes","swap_max_bytes","pids_max","server_physical_cores","client_physical_cores","numa_policy","smt_overlap","cgroup_v2","irq_exclusion","governor","epp","turbo"],"properties":{"server_cpu_max":{"type":"string","minLength":1},"client_cpu_max":{"type":"string","minLength":1},"server_memory_max_bytes":{"$ref":"#/$defs/nonnegativeInt"},"client_memory_max_bytes":{"$ref":"#/$defs/nonnegativeInt"},"swap_max_bytes":{"$ref":"#/$defs/nonnegativeInt"},"pids_max":{"$ref":"#/$defs/nonnegativeInt"},"server_physical_cores":{"$ref":"#/$defs/nonnegativeInt"},"client_physical_cores":{"$ref":"#/$defs/nonnegativeInt"},"numa_policy":{"type":"string","minLength":1},"smt_overlap":{"type":"boolean"},"cgroup_v2":{"type":"boolean"},"irq_exclusion":{"type":"boolean"},"governor":{"type":"string","minLength":1},"epp":{"type":"string","minLength":1},"turbo":{"type":"boolean"}}},
    "treatment": {"type":"object","additionalProperties":false,"required":["transport","tls","socket","resources"],"properties":{"transport":{"$ref":"#/$defs/transport"},"tls":{"$ref":"#/$defs/tls"},"socket":{"$ref":"#/$defs/socket"},"resources":{"$ref":"#/$defs/resources"}}},
    "timeouts": {"type":"object","additionalProperties":false,"required":["describe_ns","ready_ns","arm_ns","start_ack_ns","drain_ns","result_ns","terminate_ns"],"properties":{"describe_ns":{"$ref":"#/$defs/positiveInt"},"ready_ns":{"$ref":"#/$defs/positiveInt"},"arm_ns":{"$ref":"#/$defs/positiveInt"},"start_ack_ns":{"$ref":"#/$defs/positiveInt"},"drain_ns":{"$ref":"#/$defs/positiveInt"},"result_ns":{"$ref":"#/$defs/positiveInt"},"terminate_ns":{"$ref":"#/$defs/positiveInt"}}},
    "timing": {"type":"object","additionalProperties":false,"required":["progress_cadence_ns","completion_bound_ns","timeouts"],"properties":{"progress_cadence_ns":{"$ref":"#/$defs/positiveInt"},"completion_bound_ns":{"$ref":"#/$defs/positiveInt"},"timeouts":{"$ref":"#/$defs/timeouts"}}},
    "schedule": {"type":"object","additionalProperties":false,"required":["sessions","williams_rows","microblock_construction","campaign_seed_derivation","backend_order","reference_client_assignment","lane_assignment","worker_process_policy","maximum_schedule_frozen","dormant_retry_per_microblock","confirmation_branches"],"properties":{"sessions":{"$ref":"#/$defs/positiveInt"},"williams_rows":{"$ref":"#/$defs/positiveInt"},"microblock_construction":{"type":"string","minLength":1},"campaign_seed_derivation":{"type":"string","minLength":1},"backend_order":{"type":"string","minLength":1},"reference_client_assignment":{"type":"string","minLength":1},"lane_assignment":{"type":"string","minLength":1},"worker_process_policy":{"enum":["fresh_process","persistent_reset"]},"maximum_schedule_frozen":{"type":"boolean"},"dormant_retry_per_microblock":{"type":"integer","minimum":0,"maximum":1},"confirmation_branches":{"$ref":"#/$defs/nonnegativeInt"}}},
    "calibrationCount": {"type":"object","additionalProperties":false,"required":["count","probability","one_sided_95_exact_binomial_lower"],"properties":{"count":{"$ref":"#/$defs/nonnegativeInt"},"probability":{"$ref":"#/$defs/decimal"},"one_sided_95_exact_binomial_lower":{"$ref":"#/$defs/decimal"}}},
    "calibrationPlanning": {"type":"object","additionalProperties":false,"required":["blocks","raw_rows","campaigns","critical_value_simulation","cross_session_correlation","declared_effect","declared_effect_power","equivalence","family_size","margin","name","raw_session_paired_log_ratio_sd","passed","standard_error","superblock_variance_formula","twice_margin_effect","twice_margin_power"],"properties":{"blocks":{"$ref":"#/$defs/positiveInt"},"raw_rows":{"$ref":"#/$defs/positiveInt"},"campaigns":{"$ref":"#/$defs/positiveInt"},"critical_value_simulation":{"type":"object","additionalProperties":false,"required":["minimum","mean","empirical_95th","maximum"],"properties":{"minimum":{"$ref":"#/$defs/decimal"},"mean":{"$ref":"#/$defs/decimal"},"empirical_95th":{"$ref":"#/$defs/decimal"},"maximum":{"$ref":"#/$defs/decimal"}}},"cross_session_correlation":{"$ref":"#/$defs/decimal"},"declared_effect":{"$ref":"#/$defs/decimal"},"declared_effect_power":{"$ref":"#/$defs/calibrationCount"},"equivalence":{"$ref":"#/$defs/calibrationCount"},"family_size":{"$ref":"#/$defs/positiveInt"},"margin":{"$ref":"#/$defs/decimal"},"name":{"$ref":"#/$defs/id"},"raw_session_paired_log_ratio_sd":{"$ref":"#/$defs/decimal"},"passed":{"type":"boolean"},"standard_error":{"type":"string","minLength":1},"superblock_variance_formula":{"type":"string","minLength":1},"twice_margin_effect":{"$ref":"#/$defs/decimal"},"twice_margin_power":{"$ref":"#/$defs/calibrationCount"}}},
    "statisticalCalibration": {"type":"object","additionalProperties":false,"required":["artifact_sha256","algorithm_version","campaigns_per_condition","implementation_calibration_passed","profile_design_power_gate_passed","publication_analysis_permitted","independence_planning_result","planning_result"],"properties":{"artifact_sha256":{"$ref":"#/$defs/digest"},"algorithm_version":{"type":"string","minLength":1},"campaigns_per_condition":{"type":"integer","minimum":25000},"implementation_calibration_passed":{"type":"boolean"},"profile_design_power_gate_passed":{"type":"boolean"},"publication_analysis_permitted":{"type":"boolean"},"independence_planning_result":{"$ref":"#/$defs/calibrationPlanning"},"planning_result":{"$ref":"#/$defs/calibrationPlanning"}}},
    "analysis": {"type":"object","additionalProperties":false,"required":["primary_family","baseline","alpha","practical_margin","multiplicity","orientation","sign_patterns","planning_log_ratio_sd","minimum_power","statistical_calibration"],"properties":{"primary_family":{"type":"string","minLength":1},"baseline":{"$ref":"#/$defs/id"},"alpha":{"$ref":"#/$defs/decimal"},"practical_margin":{"$ref":"#/$defs/decimal"},"multiplicity":{"enum":["exact_common_sign_max_abs_t","none"]},"orientation":{"const":"positive_is_better"},"sign_patterns":{"$ref":"#/$defs/positiveInt"},"planning_log_ratio_sd":{"$ref":"#/$defs/decimal"},"minimum_power":{"$ref":"#/$defs/decimal"},"statistical_calibration":{"$ref":"#/$defs/statisticalCalibration"}}},
    "manifestPolicy": {"type":"object","additionalProperties":false,"required":["clean_tree_required","allow_diagnostic_dirty","hash_loaded_libraries","require_release_policy","require_exact_effective_commands"],"properties":{"clean_tree_required":{"type":"boolean"},"allow_diagnostic_dirty":{"type":"boolean"},"hash_loaded_libraries":{"type":"boolean"},"require_release_policy":{"type":"boolean"},"require_exact_effective_commands":{"type":"boolean"}}},
    "validity": {"type":"object","additionalProperties":false,"required":["client_cpu_p95_max","integer_operation_minimum","subwindows","reject_socket_drops","reject_cap_hits","reject_generator_starvation","require_progress_or_blocked","require_negotiated_match","require_zero_cgroup_throttling"],"properties":{"client_cpu_p95_max":{"$ref":"#/$defs/decimal"},"integer_operation_minimum":{"$ref":"#/$defs/positiveInt"},"subwindows":{"$ref":"#/$defs/positiveInt"},"reject_socket_drops":{"type":"boolean"},"reject_cap_hits":{"type":"boolean"},"reject_generator_starvation":{"type":"boolean"},"require_progress_or_blocked":{"type":"boolean"},"require_negotiated_match":{"type":"boolean"},"require_zero_cgroup_throttling":{"type":"boolean"}}},
    "retry": {"type":"object","additionalProperties":false,"required":["maximum","scope","closed_reasons","preallocated"],"properties":{"maximum":{"type":"integer","minimum":0,"maximum":1},"scope":{"enum":["localized_interval_and_complete_session"]},"closed_reasons":{"type":"array","uniqueItems":true,"items":{"$ref":"#/$defs/id"}},"preallocated":{"type":"boolean"}}},
    "cardinality": {"type":"object","additionalProperties":false,"required":["planned_trials","maximum_trial_ids","committed_samples","sessions","williams_rows"],"properties":{"planned_trials":{"$ref":"#/$defs/positiveInt"},"maximum_trial_ids":{"$ref":"#/$defs/positiveInt"},"committed_samples":{"$ref":"#/$defs/positiveInt"},"sessions":{"$ref":"#/$defs/positiveInt"},"williams_rows":{"$ref":"#/$defs/positiveInt"}}},
    "qualification": {"type":"object","additionalProperties":false,"required":["host_stability_required","worker_reuse_required","lane_interference_required","client_headroom_required","window_equivalence_required","tail_window_required"],"properties":{"host_stability_required":{"type":"boolean"},"worker_reuse_required":{"type":"boolean"},"lane_interference_required":{"type":"boolean"},"client_headroom_required":{"type":"boolean"},"window_equivalence_required":{"type":"boolean"},"tail_window_required":{"type":"boolean"}}}
  }
}
