{
  "schema_version": "quicperf.experiment.v2.3",
  "control_protocol_version": "quicperf.control.v1",
  "name": "publication-v2.3",
  "campaign_kind": "publication",
  "estimand": "fixed_treatment_server",
  "methodology": {
    "version": "2.3",
    "control_plane": {
      "arm_lead_ns": 750000000,
      "pre_send_guard_ns": 500000000,
      "pre_send_rebase_maximum": 2,
      "late_arm_retry_budget_per_session": 1,
      "live_monitoring_contract": "passive_service_events_no_live_journal_polling"
    },
    "monitor": {
      "boundary_timestamp_semantics": "observed_interval",
      "interval_duration_error_max_fraction": "0.001",
      "phase_offset_max_ns": 5000000,
      "combined_tctl_gap_max_ns": 250000000,
      "localized_transient_budget_per_session": 2
    },
    "runtime": {
      "useful_time_publication_gate": false,
      "operational_session_timeout_ns": 10800000000000,
      "deterministic_verification_budget_ns": 1200000000000,
      "admission_conservative_reservation_ns": 3847800000000,
      "analysis_finalization_export_budget_ns": 600000000000,
      "scheduled_campaign_floor_ns": 13921000000000,
      "clean_start_conservative_budget_ns": 27247800000000,
      "suite_deadline_ns": 30000000000000,
      "historical_evidence_artifact": "profiles/v2.3/evidence/pre-v2.3-runtime-policy.json",
      "historical_evidence_sha256": "ed1bb6d99c5c9cc061203c561fcc9a078d8cc21d49822d407ba7a2f348a9aedb"
    }
  },
  "roles": {
    "servers": [
      "ngtcp2perf",
      "lsperf",
      "tquicperf",
      "quicheperf",
      "picoperf",
      "xquicperf",
      "quinnperf",
      "s2nperf",
      "neqoperf",
      "noqperf",
      "quiczigperf",
      "mvfstperf"
    ],
    "reference_clients": [
      "ngtcp2perf",
      "picoperf"
    ]
  },
  "workloads": [
    {
      "scenario": "download",
      "path_profile": "loopback",
      "connections": 16,
      "streams_per_connection": 1,
      "request_body_bytes": 8,
      "response_body_bytes": 1,
      "message_body_bytes": 64,
      "datagram_body_bytes": 64,
      "application_chunk_bytes": 262144,
      "measurement_ns": 2000000000,
      "warmup_ns": 250000000,
      "operation_slots": 16,
      "concurrency_grid": [
        16
      ],
      "connection_count_grid": [
        16
      ],
      "connection_window_bytes": 67108864,
      "stream_window_bytes": 67108864,
      "ticket_chains": 0,
      "eligible_operation_limit": 0,
      "datagram_unreturned_per_connection": 0,
      "datagram_unreturned_aggregate": 0
    },
    {
      "scenario": "upload",
      "path_profile": "loopback",
      "connections": 16,
      "streams_per_connection": 1,
      "request_body_bytes": 8,
      "response_body_bytes": 1,
      "message_body_bytes": 64,
      "datagram_body_bytes": 64,
      "application_chunk_bytes": 262144,
      "measurement_ns": 2000000000,
      "warmup_ns": 250000000,
      "operation_slots": 16,
      "concurrency_grid": [
        16
      ],
      "connection_count_grid": [
        16
      ],
      "connection_window_bytes": 67108864,
      "stream_window_bytes": 67108864,
      "ticket_chains": 0,
      "eligible_operation_limit": 0,
      "datagram_unreturned_per_connection": 0,
      "datagram_unreturned_aggregate": 0
    },
    {
      "scenario": "multistream_download",
      "path_profile": "loopback",
      "connections": 16,
      "streams_per_connection": 8,
      "request_body_bytes": 8,
      "response_body_bytes": 1,
      "message_body_bytes": 64,
      "datagram_body_bytes": 64,
      "application_chunk_bytes": 262144,
      "measurement_ns": 2000000000,
      "warmup_ns": 250000000,
      "operation_slots": 16,
      "concurrency_grid": [
        16
      ],
      "connection_count_grid": [
        16
      ],
      "connection_window_bytes": 67108864,
      "stream_window_bytes": 67108864,
      "ticket_chains": 0,
      "eligible_operation_limit": 0,
      "datagram_unreturned_per_connection": 0,
      "datagram_unreturned_aggregate": 0
    },
    {
      "scenario": "multistream_upload",
      "path_profile": "loopback",
      "connections": 16,
      "streams_per_connection": 8,
      "request_body_bytes": 8,
      "response_body_bytes": 1,
      "message_body_bytes": 64,
      "datagram_body_bytes": 64,
      "application_chunk_bytes": 262144,
      "measurement_ns": 2000000000,
      "warmup_ns": 250000000,
      "operation_slots": 16,
      "concurrency_grid": [
        16
      ],
      "connection_count_grid": [
        16
      ],
      "connection_window_bytes": 67108864,
      "stream_window_bytes": 67108864,
      "ticket_chains": 0,
      "eligible_operation_limit": 0,
      "datagram_unreturned_per_connection": 0,
      "datagram_unreturned_aggregate": 0
    },
    {
      "scenario": "bidi",
      "path_profile": "loopback",
      "connections": 16,
      "streams_per_connection": 1,
      "request_body_bytes": 8,
      "response_body_bytes": 1,
      "message_body_bytes": 64,
      "datagram_body_bytes": 64,
      "application_chunk_bytes": 262144,
      "measurement_ns": 2000000000,
      "warmup_ns": 250000000,
      "operation_slots": 16,
      "concurrency_grid": [
        16
      ],
      "connection_count_grid": [
        16
      ],
      "connection_window_bytes": 67108864,
      "stream_window_bytes": 67108864,
      "ticket_chains": 0,
      "eligible_operation_limit": 0,
      "datagram_unreturned_per_connection": 0,
      "datagram_unreturned_aggregate": 0
    },
    {
      "scenario": "loss_recovery",
      "path_profile": "loss_recovery_v1",
      "connections": 16,
      "streams_per_connection": 1,
      "request_body_bytes": 8,
      "response_body_bytes": 1,
      "message_body_bytes": 64,
      "datagram_body_bytes": 64,
      "application_chunk_bytes": 262144,
      "measurement_ns": 5000000000,
      "warmup_ns": 500000000,
      "operation_slots": 16,
      "concurrency_grid": [
        16
      ],
      "connection_count_grid": [
        16
      ],
      "connection_window_bytes": 67108864,
      "stream_window_bytes": 67108864,
      "ticket_chains": 0,
      "eligible_operation_limit": 0,
      "datagram_unreturned_per_connection": 0,
      "datagram_unreturned_aggregate": 0
    },
    {
      "scenario": "flow_control",
      "path_profile": "loopback",
      "connections": 16,
      "streams_per_connection": 1,
      "request_body_bytes": 8,
      "response_body_bytes": 1,
      "message_body_bytes": 64,
      "datagram_body_bytes": 64,
      "application_chunk_bytes": 262144,
      "measurement_ns": 2000000000,
      "warmup_ns": 250000000,
      "operation_slots": 16,
      "concurrency_grid": [
        16
      ],
      "connection_count_grid": [
        16
      ],
      "connection_window_bytes": 262144,
      "stream_window_bytes": 65536,
      "ticket_chains": 0,
      "eligible_operation_limit": 0,
      "datagram_unreturned_per_connection": 0,
      "datagram_unreturned_aggregate": 0
    },
    {
      "scenario": "small_payload_pps",
      "path_profile": "loopback",
      "connections": 16,
      "streams_per_connection": 1,
      "request_body_bytes": 1,
      "response_body_bytes": 1,
      "message_body_bytes": 64,
      "datagram_body_bytes": 64,
      "application_chunk_bytes": 262144,
      "measurement_ns": 2000000000,
      "warmup_ns": 250000000,
      "operation_slots": 16,
      "concurrency_grid": [
        16
      ],
      "connection_count_grid": [
        16
      ],
      "connection_window_bytes": 67108864,
      "stream_window_bytes": 67108864,
      "ticket_chains": 0,
      "eligible_operation_limit": 0,
      "datagram_unreturned_per_connection": 0,
      "datagram_unreturned_aggregate": 0
    },
    {
      "scenario": "datagram",
      "path_profile": "loopback",
      "connections": 16,
      "streams_per_connection": 1,
      "request_body_bytes": 1,
      "response_body_bytes": 1,
      "message_body_bytes": 64,
      "datagram_body_bytes": 64,
      "application_chunk_bytes": 262144,
      "measurement_ns": 2000000000,
      "warmup_ns": 250000000,
      "operation_slots": 2048,
      "concurrency_grid": [
        16
      ],
      "connection_count_grid": [
        16
      ],
      "connection_window_bytes": 67108864,
      "stream_window_bytes": 67108864,
      "ticket_chains": 0,
      "eligible_operation_limit": 0,
      "datagram_unreturned_per_connection": 128,
      "datagram_unreturned_aggregate": 2048
    },
    {
      "scenario": "reqresp",
      "path_profile": "loopback",
      "connections": 16,
      "streams_per_connection": 1,
      "request_body_bytes": 64,
      "response_body_bytes": 1024,
      "message_body_bytes": 64,
      "datagram_body_bytes": 64,
      "application_chunk_bytes": 262144,
      "measurement_ns": 2000000000,
      "warmup_ns": 250000000,
      "operation_slots": 16,
      "concurrency_grid": [
        16
      ],
      "connection_count_grid": [
        16
      ],
      "connection_window_bytes": 67108864,
      "stream_window_bytes": 67108864,
      "ticket_chains": 0,
      "eligible_operation_limit": 0,
      "datagram_unreturned_per_connection": 0,
      "datagram_unreturned_aggregate": 0
    },
    {
      "scenario": "stream_churn",
      "path_profile": "loopback",
      "connections": 16,
      "streams_per_connection": 1,
      "request_body_bytes": 1,
      "response_body_bytes": 1,
      "message_body_bytes": 1,
      "datagram_body_bytes": 64,
      "application_chunk_bytes": 262144,
      "measurement_ns": 2000000000,
      "warmup_ns": 250000000,
      "operation_slots": 16,
      "concurrency_grid": [
        16
      ],
      "connection_count_grid": [
        16
      ],
      "connection_window_bytes": 67108864,
      "stream_window_bytes": 67108864,
      "ticket_chains": 0,
      "eligible_operation_limit": 0,
      "datagram_unreturned_per_connection": 0,
      "datagram_unreturned_aggregate": 0
    },
    {
      "scenario": "close_reset_cleanup",